Sheet: 电子巡航
A1: 张家港海事局电子巡航统计信息一览表
A2: 填报单位：支队 | F2: 填报日期：2017.02.15
A3: 序号 | B3: 电子巡航部门（单位） | C3: 巡航人员 | D3: 巡航起止时间 | E3: 巡航区域 | F3: 发现解决的问题 | G3: 备注 | H3: 巡航次数 | I3: 巡航时间（小时）十进制 | J3: 发现违章数量
A4: 1 | B4: 执法支队 | C4: 冀凯 | D4: 02月15日 0830-0930 0940-1040 1050-1130 1220-1320 1330-1430 1440-1530 1530-1640 | E4: 双狮、大柏墩，双山取水口、福南下口、12.5米深水航道水工作业区等水域 | F4: 无视频图像：室内监控6、IPCamera07、室内监控10、室内监控12、室内监控2、室外监控球机1、老沙基地室外监控球机1、老沙基地室外监控球机2、 | H4: 7 | I4: 5.4 | J4: 0
A5: 2
A6: 3
A7: 4
A8: 5
A9: 6
A10: 7
A11: 8
A12: 合计 | H12: 7 | I12: 5.4 | J12: 0
G13: 填表人 | I13: 冀凯
A15: 1.填报内容时间：上一日1630时至当日1630时。 2.每日报送时间：1640-1650时，发送至指挥中心RTX。 3.巡航区域填写：不得填写网格，应写明航道、锚地、停泊区、码头等。 4.有执法行为的执法人员应至少2人。

Sheet: 现场巡航
A1: 张家港海事局局海巡艇现场巡航情况统计分析表
A2: 填报单位：支队 | J2: 日期:2017.02.15
A3: 序号 | B3: 海巡艇 | C3: 执法人员 | D3: 巡航起止时间 | E3: 巡航时长 （小时）十进制 | F3: 巡航水域 | G3: 发现解决的问题 | H3: 备注 | I3: 执法人员数量 | J3: 巡航次数 | K3: 巡航里程 （海里） | L3: 发现违章数量 | M3: 取水口检查次数 | N3: 重点工程情况（沪通长江大桥工程建设、老海坝节点综合整治工程、通州沙西水道整治工程）、辖区水工作业、新船下水试航、船舶舾装动态
A4: ${number} | B4: ${name} | C4: ${cruise_people} | D4: ${cruise_time_detail} | E4: ${cruise_time_total} | F4: ${cruise_location} | G4: ${solve_problem} | H4: ${note} | I4: ${cruise_people_number} | J4: ${cruise_times} | K4: ${cruise_distance} | L4: ${cruise_wz} | M4: ${qsk}{ | N4: ${date_of_cruise}作业正常
A5: 合计 | E5: =R[-6]C+R[-5]C -> 10.899999999999999 | F5: / | I5: =R[-6]C+R[-5]C -> 11 | J5: =R[-6]C+R[-5]C -> 5 | K5: =R[-6]C+R[-5]C -> 131 | L5: =R[-6]C+R[-5]C -> 4 | M5: =R[-6]C+R[-5]C -> 3
A7: 渡运数据 | B7: 通沙汽渡/张皋汽渡/双山汽渡 航次数
B8: 通沙汽渡/张皋汽渡/双山汽渡 渡运车次
B9: 通沙汽渡/张皋汽渡/双山汽渡 渡运人次
A10: 寒潮大风 | B10: 发放资料（份数）
B11: 宣传次数
A12: VTS监控数据 | B12: 到港受限船舶（艘次）
B13: 过境受限船舶（艘次）
B14: 接受船位报告（艘次）
B15: 重点监控船舶（艘次）
A16: 1.填报内容时间：上一日1630时至当日1630时。 2.每日报送时间：1640-1650时，发送至指挥中心RTX。 3.巡航区域填写：不得填写网格，应写明航道、锚地、停泊区、码头等。 4.有执法行为的执法人员应至少2人，海巡艇一般需有执法人员。 5.在备注栏标明前一日与当日的夜航艇。 6.如多条海巡艇为同一班船员，填报时将只需填写一条海巡艇，时间等累加。